candidate_name,resume_text,cleaned_resume,extracted_skills
Alice Johnson,"Experienced Data Scientist with 5 years in Python, Machine Learning, and SQL. Expert in Scikit-learn, Pandas, and data visualization using Matplotlib. Strong background in statistical analysis and predictive modeling.",experienced data scientist years python machine learning sql expert scikit learn pandas data visualization using matplotlib strong background statistical analysis predictive modeling,"['statistical analysis', 'data visualization', 'scikit-learn', 'sql', 'pandas', 'predictive modeling', 'matplotlib', 'python', 'machine learning']"
Bob Smith,"Software Engineer with a focus on web development. Proficient in JavaScript, React, Node.js, and HTML/CSS. Basic knowledge of Python and SQL. Interested in transitioning to Machine Learning roles.",software engineer focus web development proficient javascript react node js html css basic knowledge python sql interested transitioning machine learning roles,"['javascript', 'css', 'sql', 'node.js', 'python', 'machine learning', 'html', 'react']"
Charlie Brown,"Machine Learning Engineer specialized in NLP and Deep Learning. Expert in PyTorch, TensorFlow, and spaCy. Strong skills in Python, feature engineering, and model deployment.",machine learning engineer specialized nlp deep learning expert pytorch tensorflow spacy strong skills python feature engineering model deployment,"['tensorflow', 'pytorch', 'nlp', 'model deployment', 'python', 'machine learning', 'feature engineering', 'deep learning']"
Diana Prince,"Data Analyst with 3 years of experience. Proficient in Excel, SQL, and Tableau. Some experience with Python and R for data cleaning and basic statistical analysis.",data analyst years experience proficient excel sql tableau experience python r data cleaning basic statistical analysis,"['statistical analysis', 'tableau', 'sql', 'r', 'excel', 'python', 'data cleaning']"
Edward Norton,Project Manager with experience in Agile and Scrum. Strong communication and leadership skills. Familiar with Jira and Trello. No technical background in programming or ML.,project manager experience agile scrum strong communication leadership skills familiar jira trello technical background programming ml,"['trello', 'jira', 'scrum', 'agile']"
